{
  "$schema": "https://json-schema.org/draft/2020-12/schema",
  "$id": "https://compliance.example/schemas/policy/control-requirement-v1alpha1.schema.json",
  "title": "Technology-neutral compliance control requirement",
  "type": "object",
  "required": ["apiVersion", "kind", "metadata", "spec"],
  "additionalProperties": false,
  "properties": {
    "apiVersion": {"const": "compliance.example/v1alpha1"},
    "kind": {"const": "ControlRequirement"},
    "metadata": {
      "type": "object",
      "required": ["id", "revision"],
      "additionalProperties": false,
      "properties": {
        "id": {"$ref": "#/$defs/identifier"},
        "revision": {"$ref": "#/$defs/revision"},
        "origin": {
          "type": "object",
          "required": ["type", "name"],
          "additionalProperties": true,
          "properties": {
            "type": {"type": "string", "minLength": 1},
            "name": {"type": "string", "minLength": 1}
          }
        }
      }
    },
    "spec": {
      "type": "object",
      "required": ["title", "statement"],
      "additionalProperties": false,
      "properties": {
        "title": {"type": "string", "minLength": 1},
        "statement": {"type": "string", "minLength": 1},
        "rationale": {"type": "string", "minLength": 1},
        "external_refs": {
          "type": "array",
          "uniqueItems": true,
          "items": {"type": "string", "minLength": 1}
        }
      }
    }
  },
  "$defs": {
    "identifier": {
      "type": "string",
      "minLength": 1,
      "pattern": "^[a-z0-9][a-z0-9._-]*$"
    },
    "revision": {
      "oneOf": [
        {"type": "integer", "minimum": 1},
        {"type": "string", "minLength": 1}
      ]
    }
  }
}
