{
  "apiVersion": "compliance.example/v1alpha1",
  "kind": "ControlRequirement",
  "metadata": {
    "id": "company.administrative-access.identity-gated",
    "revision": 1,
    "origin": {
      "type": "company-control-objective",
      "name": "Company administrative access standard"
    }
  },
  "spec": {
    "title": "Administrative access is gated by managed identity controls",
    "statement": "Interactive administrative access is gated by centrally managed identity controls, and unmanaged local or guest access paths are disabled.",
    "rationale": "Restricting administrative access to managed identity paths makes access governance and revocation consistent across platform types."
  }
}
