{
  "apiVersion": "compliance.example/v1alpha1",
  "kind": "ControlRequirement",
  "metadata": {
    "id": "verification.operation.host.o1",
    "revision": 1,
    "origin": {
      "type": "company-control-objective",
      "name": "Synthetic company target"
    }
  },
  "spec": {
    "title": "Attributable company host requirement",
    "statement": "Require an attributable assertion and any named consumer relationship for this exact subject.",
    "rationale": "Synthetic proof of explicitly assigned company intent.",
    "external_refs": [
      "synthetic-framework:Q"
    ]
  }
}
